Eje 1. Gobierno honesto, cercano y moderno,Indicador, Fuente, Descripcion, Teporalidad,Confiabilidad de la fuente, Ultimo Dato Disponible,Valor Hidalgo, Valor Nacional,Lugar Nacional
 ,Ocupación del Gobierno,México ¿Cómo Vamos?,1T 2020,4.8%,4.1%,23,
 ,Deuda Pública,México ¿Cómo Vamos?,2019,1.50%,2.90%,11,
 ,Transparencia. Coeficiente TAI (Transparencia, Anticorrupción, Impunidad cero),Transparencia Mexicana,2017,69.03,60.59,25,
 ,Percepción de la población sobre la efectividad del Gobierno de su Ciudad (Pachuca de soto, Hgo.) para resolver las principales problemáticas,Encuesta Nacional de Seguridad Urbana ENSU,03/2020,24.2,25.4,-,
 ,Índice de Información Presupuestal Municipal 2017,IMCO, Índice de información presupuestal municipal,2017,89% en Pachuca de Soto,100% en Coahuila,80,
 ,Índice de Desarrollo Democrático de México (IDDMEX),IDD-Mex: www.idd-mex.org,2019,6,892,5,662 Valor promedio de los estados,11,
 ,Índice de Transparencia y Disponibilidad de la Información Fiscal (ITDIF),Aregional,2019,88.85,79.93,12,
 ,Producción bruta total (millones de pesos),INEGI. Censos Económicos 2019.,2019,401,036.694,22,212,249.976,18,
